"DESCRIPTION","DURATION IN MS","NAME","PARENT SUITE","START TIME","STATUS","STOP TIME","SUB SUITE","SUITE","TEST CLASS","TEST METHOD"
"","1290","Create article with defoult title","chromium","2026-03-14","passed","2026-03-14","","conduit.spec.ts","",""
"","1644","Create article with check Screenshot","chromium","2026-03-14","passed","2026-03-14","","conduit.spec.ts","",""
"","672","Hybrid Login via Playwright API Request","chromium","2026-03-14","passed","2026-03-14","","fastLoginWithoutAxios.spec.ts","",""
"","664","Hibrid API + UI Test (Fast Login)","chromium","2026-03-14","passed","2026-03-14","","fastLoginFromAxios.spec.ts","",""
"","2167","Create, update annd delete article with custom title","chromium","2026-03-14","passed","2026-03-14","","conduit.spec.ts","",""
