"DESCRIPTION","DURATION IN MS","NAME","PARENT SUITE","START TIME","STATUS","STOP TIME","SUB SUITE","SUITE","TEST CLASS","TEST METHOD"
"","11353","Create, update annd delete article with custom title","chromium","2026-03-13","failed","2026-03-13","","conduit.spec.ts","",""
"","676","Hybrid Login via Playwright API Request","chromium","2026-03-13","passed","2026-03-13","","fastLoginWithoutAxios.spec.ts","",""
"","1886","Create article with check Screenshot","chromium","2026-03-13","passed","2026-03-13","","conduit.spec.ts","",""
"","1403","Create article with defoult title","chromium","2026-03-13","passed","2026-03-13","","conduit.spec.ts","",""
"","675","Hibrid API + UI Test (Fast Login)","chromium","2026-03-13","passed","2026-03-13","","fastLoginFromAxios.spec.ts","",""
